{
  "schema_version": "0.1.0",
  "contrast_id": "als_cns_dimn_extended_gse68605",
  "benchmark_id": "als_pandaomics",
  "dataset_ids": [
    "GSE68605"
  ],
  "modality": "transcriptomics",
  "tissue": "motor_neurons",
  "case_definition": "Motor neurons from familial ALS C9ORF72 expansion carriers",
  "control_definition": "Matched control motor neurons",
  "analysis_unit": "bulk_rna",
  "comparison_label": "GSE68605 curated first-wave contrast",
  "sample_counts": {
    "case": 8,
    "control": 3
  },
  "inclusion_rule_summary": "Included in curated subset als_cns_dimn_extended because explicit table 1 motor-neuron comparison with accession-coded case and control counts.",
  "exclusion_rule_summary": "Restrict the contrast to the curated case and control arms defined in configs/subsets/als_cns_dimn_extended.yaml.",
  "leakage_risks": [
    "Do not use downstream validation outcomes as discovery-time features."
  ],
  "status": "verified",
  "provenance": {
    "primary_source_url": "https://www.ncbi.nlm.nih.gov/geo/query/acc.cgi?acc=GSE68605",
    "notes": "Generated from curated subset als_cns_dimn_extended."
  }
}
