{
  "schema_version": "0.1.0",
  "contrast_id": "ipf_lung_extended_gse24206",
  "benchmark_id": "ipf_tnik",
  "dataset_ids": [
    "GSE24206"
  ],
  "modality": "transcriptomics",
  "tissue": "lung",
  "case_definition": "Idiopathic pulmonary fibrosis lung tissue",
  "control_definition": "Healthy donor lungs collected at transplantation",
  "analysis_unit": "bulk_rna",
  "comparison_label": "GSE24206 curated first-wave contrast",
  "sample_counts": {
    "case": 17,
    "control": 6
  },
  "inclusion_rule_summary": "Included in curated subset ipf_lung_extended because direct ipf versus healthy-donor lung comparison with a live accession-backed microarray loader.",
  "exclusion_rule_summary": "Restrict the contrast to the curated case and control arms defined in configs/subsets/ipf_lung_extended.yaml.",
  "leakage_risks": [
    "Do not use downstream validation outcomes as discovery-time features."
  ],
  "status": "verified",
  "provenance": {
    "primary_source_url": "https://www.ncbi.nlm.nih.gov/geo/query/acc.cgi?acc=GSE24206",
    "notes": "Generated from curated subset ipf_lung_extended."
  }
}
