{
  "schema_version": "0.1.0",
  "contrast_id": "als_cns_dimn_extended_gse67196_sals_cereb",
  "benchmark_id": "als_pandaomics",
  "dataset_ids": [
    "GSE67196_sals_cereb"
  ],
  "modality": "transcriptomics",
  "tissue": "cerebellum",
  "case_definition": "Sporadic ALS cerebellum samples",
  "control_definition": "Healthy cerebellum samples",
  "analysis_unit": "bulk_rna",
  "comparison_label": "GSE67196_sals_cereb curated first-wave contrast",
  "sample_counts": {
    "case": 10,
    "control": 8
  },
  "inclusion_rule_summary": "Included in curated subset als_cns_dimn_extended because split from gse67196 table 1 cerebellar sporadic als comparison using the public rawcount matrix.",
  "exclusion_rule_summary": "Restrict the contrast to the curated case and control arms defined in configs/subsets/als_cns_dimn_extended.yaml.",
  "leakage_risks": [
    "Do not use downstream validation outcomes as discovery-time features."
  ],
  "status": "verified",
  "provenance": {
    "primary_source_url": "https://www.ncbi.nlm.nih.gov/geo/query/acc.cgi?acc=GSE67196_sals_cereb",
    "notes": "Generated from curated subset als_cns_dimn_extended."
  }
}
