{
  "schema_version": "0.1.0",
  "contrast_id": "ipf_lung_extended_gse92592",
  "benchmark_id": "ipf_tnik",
  "dataset_ids": [
    "GSE92592"
  ],
  "modality": "transcriptomics",
  "tissue": "lung",
  "case_definition": "Idiopathic pulmonary fibrosis lung tissue",
  "control_definition": "Control lung tissue",
  "analysis_unit": "bulk_rna",
  "comparison_label": "GSE92592 curated first-wave contrast",
  "sample_counts": {
    "case": 20,
    "control": 19
  },
  "inclusion_rule_summary": "Included in curated subset ipf_lung_extended because direct ipf versus control lung rna-seq cohort from ltrc with a live matrix-backed loader.",
  "exclusion_rule_summary": "Restrict the contrast to the curated case and control arms defined in configs/subsets/ipf_lung_extended.yaml.",
  "leakage_risks": [
    "Do not use downstream validation outcomes as discovery-time features."
  ],
  "status": "verified",
  "provenance": {
    "primary_source_url": "https://www.ncbi.nlm.nih.gov/geo/query/acc.cgi?acc=GSE92592",
    "notes": "Generated from curated subset ipf_lung_extended."
  }
}
