{
  "schema_version": "0.1.0",
  "contrast_id": "ipf_lung_core_gse52463",
  "benchmark_id": "ipf_tnik",
  "dataset_ids": [
    "GSE52463"
  ],
  "modality": "transcriptomics",
  "tissue": "lung",
  "case_definition": "Idiopathic pulmonary fibrosis lung tissue",
  "control_definition": "Healthy control lung tissue",
  "analysis_unit": "bulk_rna",
  "comparison_label": "GSE52463 curated first-wave contrast",
  "sample_counts": {
    "case": 8,
    "control": 7
  },
  "inclusion_rule_summary": "Included in curated subset ipf_lung_core because direct lung case-control rna-seq cohort with explicit counts.",
  "exclusion_rule_summary": "Restrict the contrast to the curated case and control arms defined in configs/subsets/ipf_lung_core.yaml.",
  "leakage_risks": [
    "Do not use downstream validation outcomes as discovery-time features."
  ],
  "status": "verified",
  "provenance": {
    "primary_source_url": "https://www.ncbi.nlm.nih.gov/geo/query/acc.cgi?acc=GSE52463",
    "notes": "Generated from curated subset ipf_lung_core."
  }
}
