{
  "schema_version": "0.1.0",
  "contrast_id": "als_cns_core_gse20589",
  "benchmark_id": "als_pandaomics",
  "dataset_ids": [
    "GSE20589"
  ],
  "modality": "transcriptomics",
  "tissue": "motor_neurons",
  "case_definition": "Motor neurons from familial ALS SOD1 carriers",
  "control_definition": "Matched control motor neurons",
  "analysis_unit": "bulk_rna",
  "comparison_label": "GSE20589 curated first-wave contrast",
  "sample_counts": {
    "case": 3,
    "control": 7
  },
  "inclusion_rule_summary": "Included in curated subset als_cns_core because explicit table 1 motor-neuron comparison with accession-coded case and control counts.",
  "exclusion_rule_summary": "Restrict the contrast to the curated case and control arms defined in configs/subsets/als_cns_core.yaml.",
  "leakage_risks": [
    "Do not use downstream validation outcomes as discovery-time features."
  ],
  "status": "verified",
  "provenance": {
    "primary_source_url": "https://www.ncbi.nlm.nih.gov/geo/query/acc.cgi?acc=GSE20589",
    "notes": "Generated from curated subset als_cns_core."
  }
}
