{
  "schema_version": "0.1.0",
  "contrast_id": "hcc_cdk20_discovery",
  "benchmark_id": "hcc_cdk20",
  "dataset_ids": [
    "GSE36376",
    "GSE107170",
    "GSE102079",
    "GSE45267",
    "GSE133039",
    "GSE104766",
    "GSE77314",
    "GSE60502",
    "E-MTAB-5905",
    "TCGA-LIHC"
  ],
  "modality": "transcriptomics",
  "tissue": "liver",
  "case_definition": "Hepatocellular carcinoma tumor tissue",
  "control_definition": "Healthy or adjacent normal liver tissue",
  "analysis_unit": "bulk_rna",
  "comparison_label": "Paper-disclosed multi-cohort liver-cancer discovery pool used in the CDK20 study",
  "sample_counts": null,
  "inclusion_rule_summary": "This record mirrors the 10 cohorts explicitly listed in the CDK20 paper, even though the public pool is heterogeneous.",
  "exclusion_rule_summary": "Do not let AlphaFold targetability, Chemistry42 generation, or later biochemical assays leak into the discovery contrast. Do not assume every cohort is adult HCC versus healthy liver.",
  "leakage_risks": [
    "Target-discovery evidence must stay separate from later chemistry success.",
    "Adjacent-normal tissue may not be equivalent to healthy liver across all cohorts.",
    "The public cohort pool includes hepatoblastoma and mixed liver-disease comparisons."
  ],
  "status": "partial",
  "provenance": {
    "primary_source_url": "https://pmc.ncbi.nlm.nih.gov/articles/PMC9906638/",
    "notes": "The paper gives aggregate sample totals across these cohorts, but the public accessions reveal disease-definition heterogeneity that makes this unsuitable as a clean HCC-only contrast."
  }
}
